"spiritual"|"Connect with Nature"|"Get outside and connect with nature in some way.  I am not talking about climbing Mount Washington, although you could, I am talking about going for a walk, a hike, a bike ride, a stroll, through a park, by a lake (not through it unless in a canoe), up a hillside.  New Britain has some phenomenal rose gardens, the Stanley Quarter park, and some nice rides around lakes.  Be out in the fresh air and let yourself relax.  Spend an afternoon watching the wildlife in the park – maybe feed some birds.  We are all part of the greater life that surrounds us."
"emotional"|"To-Do or Not To-Do"|"To-Do list of 5-6 items only and schedule out homework at the same times each day to make it a habit – To Do lists are designed to make your life easier and make you more successful.  The lists contain the most important work for that given day and generally take no more than a few moments to create.  People who lay awake at night and think of the things to be done the next day can generate the list and get to bed knowing it has been noted.  Now, the length of the list, 5-6 items only, has been chosen because it is doable; people can feel good that they were able to complete so many things in a day and not feel like they have only done half the list.  We need that positive sense of accomplishment.  Now, everybody can put simple things on the list such as put on my shoes and tie my shoes, but that would be the opposite of putting down fly to Nepal and climb to base camp.  The items on the list need to be mostly doable within a day.  For larger projects, break it down to smaller components, as in writing a term paper.  If you create these lists and want to track your progress, then save them over time and you will find out what times of day you are most productive for which tasks.  Speaking of that, doing homework about the same time each day allows you to get the work done, or at least make sure you have time to do the work.  The only encouragement would be not to multitask.  If I am doing homework, while my roommate is socializing, my train of thought will focus on words of the conversation instead of my homework."
"emotional"|"Stress Less"|"Maintain daily awareness of your stress level and reduce activity when stress is high.  Each day, I can give my stress level a number between 1 and 10.  One is least stressed – so relaxed and 10 is most stressed – melt down time.  The reason for giving each day a number is to monitor your stress throughout the week.  No brainer – less stressed on the weekend and most stressed during the week, not necessarily.  There are weekends during midterms when studying and socializing do not mix.  Or, you get to spend the weekend at a significant others house and get to be stressed by others there.  To be truthful, relationships cause more stress than most other things, because they are more unpredictable than other things.  Allow yourself the time to be aware of the things in your world causing you stress and consider ways of making changes to improve your level of stress.  If you are feeling too stressed too much of the time, come in and see a Counselor, so that the situation doesn’t get worse"
"emotional"|"Breate In, Breathe Out"|"Take 10 minutes a day to deep breath and imagine a calming place.  Seriously, the benefits to this can be enormous.  The breathing needs to be from your diaphragm; your stomach has to move.  Most people will breathe to a count, such as breathe into a count of 7, hold for a count of 2, and then breathe out to a count of 7.  While breathing in this manner, close your eyes and imagine a beautiful, peaceful place in your world or from your past.  Allow yourself to consider the sights, smells, sounds, and touch of this place while breathing and relaxing.  Offer yourself a chance, if possible, to be there again once you have completed your academic work.  In relaxing in this manner three times a day, it allows you an opportunity to decrease your level of stress creating a buffer when new stressors come from the day.  When you get good at relaxing, try to listen to music while relaxing.  Those successful with adding music will be able to play the music and their bodies will automatically start to relax due to muscle memory.  Imagine, being in a traffic jam, listening to a song, and relaxing.  It is possible."
"emotional"|"Reward Yourself"|"Give yourself an activity, such as spending a day in Boston as a reward for getting through the semester.  Plan out a day trip – does not matter the location, except Mars, do not plan for Mars – something doable. You may have to save a little money, but the bus system can get you quite far in Connecticut.  Then, during each week, take time to relax and plan out something else to do on the trip.  You may be going to downtown Hartford, but look into the travel to and from, the places to eat, what you will be able to see when you get there, etc.  many times, there are so many interesting things to do you have to pick and choose.  If you cannot go far, but what to know what you can do – ask someone from that city.  You may be impressed with the activities. If you really cannot afford anything, then pick a trip to plan for when you graduate.  Think about spending some time of that summer working and then going on a trip at the end of the summer or early in the fall.  You may get a job before graduation, then tell them at interview about the trip you had planned for September, so you still get to take the trip."
"emotional"|"Check Off that Work"|"Keep an eye on your classroom requirements and check them off as you complete them.  Nothing keeps us more emotionally well than being able to stay on top of our work.  For students, that work is coming from 3-5 different sources who do not talk with each other about homework.  As you check off the assignments, you complete 3 tasks: 1 seeing what you have done, 2 seeing what you have to do, and 3 planning out your time.  If you do not understand an assignment or need more time, seek out your professor during office hours or before/after class.  If you really want to take that extra step, you can figure out how many total points you have towards your grade by looking at the grade on the assignment and multiplying it by the value of that assignment.  Let us say a paper is worth 20 percent of my grade and I get an 80 on the paper – then I multiply 80X0.2 and get 16 points towards my final grade.  Sometimes doing this can make a student nervous, but better to know."
"emotional"|"No Complaint Roomates"|"Creating a healthy roommate environment – Mark Twain once commented that guests are like fish, they are only good for 3 days.  You will not get along with everyone you will be living with throughout your lifetime.  To create a healthy roommate environment, first focus on compromise.  Everyone in the room needs to be able to compromise for everyone to get along.  The first step is to sit down and find out what lifestyle everyone would like to have in the room.  Then start working on moving toward that environment.  Sometimes, there will eb an issue in which compromise is limited, such as temperature of the room.  Then one may have to rely on majority and the person may decide to move along.  However, if compromise can be reached then the rules get created including consequences for when rules are broken.  Individuals need to have a sense of order, so everyone has the same understanding.  As an example, dirty dishes – how long should they stay in the sink?  For some hours, other days…who do you think will be doing most of the dishes if left up to chance?  If you are unable to compromise, then choose to live alone – costs will be higher, but you will get the chance to create a healthy room for yourself, or as healthy as possible."
"environmental"|"Study Nook"|"Find a quiet place on campus to study.  Unless you can block out noise, find a quiet place to study, such as in the library, the fourth floor of Vance academic building, a back corner section of Willard Diloreto near the card office, inside the Wellness section of Student Wellness Center.  Try to get back to the place as often as you can so you can determine when the quiet moments are available.  Too many people try to study in a noisy area and get distracted.  Their homework takes longer and is not as good as when they can maintain focus on the homework alone.  Try doing homework when you are hungry, while people around you eat foods you like to eat.  You really cannot help but look up from time to time wishing you were having a meal."
"environmental"|"Sleep Well"|"Make sure you have a place that is comfortable for sleeping.  One of the biggest complaints from students is the lack of time to sleep.  Now, add on the fact that the room is too warm, or the roommate snores, or roommates come in when you are trying to sleep, or it’s not your room – the one you left behind.  Eventually, you will be able to find a way to compensate to the best of your exhausted ability, but sleep will not be as good.  Sleep is such an important commodity – in general people sleep better in a slightly cooler room.  They vary on noise level, but bright lights almost always interfere with the sleep/wake cycle.  Sleeping in on the weekend does not catch you up, especially on REM sleep.  You are better off figuring out a way to compromise on the interruptions to sleep.  Some individuals cannot get along when it comes to sleep.  Sleep deprivation interferes with the memory/concentration, mood, ability to process information, ability to fight off infections and overall sense of wellbeing."
"environmental"|"Socializing at Meals"|"Meals should be with peers whenever possible – we are social beings, so spending time with peers while eating allows us to accomplish two tasks at once.  We have the opportunity to find out what is happening in people’s lives as well as talk about the difficulties with classes, or work or whatever.  As we eat, we need to keep aware of emotional eating.  If our friends are emotional eaters, we may want to wait to get food until after they have finished their first round of lunch.  Meals should be slow and relaxed – allowing us time to begin to feel full – takes about 20 minutes.  Many times, people will decide on what they want to eat as they go through the lunch line.  Do not, take a step back and figure out what you would like to eat – then get the food."
"environmental"|"Discovering the Neighborhood"|"Take time to get to know your surroundings.  I am not saying look left and right in each class to see who sits next to you, that should be an automatic along with a greeting.  Get to know the campus and the shops and restaurants that surround the campus.  The reason is you may want to have lunch at a local establishment for a change of pace.  Or, your roommate may need something, and you can point them in the right direction.  The longer you stay anywhere, the more you should get to know your surroundings.  New Britain has an art museum, an industry museum, a large toy store, a soda factory, and much more.  These things will not come to you, you get to seek them out.  Last semester, businesses gave students a break in visiting downtown New Britain, something to check on every semester.  The buses can get you to shopping centers and more – you can get a free bus pass at the Card office.  The more you know about the surrounding area, the more interesting you will become to other students."
"environmental"|"Be the One"|"Practice what you preach. Follow through on ways to change your world. It does not have to be big, just has to be for you.  You do not have to pick up all the trash in New Britain, but you can pick up around a particular building.  You do not have to walk every dog at the shelter, but the three you do walk twice a week will appreciate it.  The little things add up if everyone is doing the little things.  Start with your own words.  What do you complain about and in what way can you make a difference?  If you believe it is important enough, share the idea with the student government.  Who knows, you may not start a trend, you may start a movement.  Many years ago, a student wanted to clean up around the campus. That student was joined by another 40 students and now we have a day dedicated to helping to clean up New Britain."
"environmental"|"No Goal in Life"|"No Goal in Life How to deal with not having goals: When an individual has no goals in life and finds themselves wandering, one of the best things they can do is find others who have goals and ask them how they came to those goals, try to pick someone who is at the same developmental stage in life.  Another tasks that may help is to begin to identify your last goal and how you came to have that as a goal.  Many times, young adults find that goals gave almost been proscribed for them.  You go to High School and then on to college, that is just what you do.  If that is the case, then begin to think about what you would like your future to look like in 5 years – I want a mansion and a yacht.  That is possible; however, not as probable as a nice 2-bedroom apartment and a canoe.  Whatever the goal, write it down and then write down the steps to obtaining the goal.  The steps may include passing certain difficult courses, cutting back on expenses so you can save the money for a canoe, or starting to price 2-bedroom apartments near where you would like to work.  Another avenue is to seek counseling whether it be career counseling, personal counseling, or financial counseling to move you closer to identifying goals.  Once you have the goal, steps to obtaining the goal, then track your progress and make necessary adjustments."
"occupational"|"Clubs and Intermurals"|"Seek out something new.  We have so many clubs and intramurals every semester or every year try something new.  You do not have to stick with it, you just need to try it.  Do you like broccoli, whether yes or no, you still had to try it.  Seek out the sport or the club activity and try it out.  Sometimes, people find what they like to do the club activities more than their own major and then change majors that are similar to the club.  If you cannot find a club on campus, feel free to create a club.  All you need do is put up flyers and get several students interested.  Then create an executive committee and petition student life to create the club."
"occupational"|"Arts & Crafts"|"Arts & crafts club and Wellness Education community hours involve arts and crafts while socializing.  Sometimes when we are worried about being in a social situation, it is best to have an activity to occupy our hands while we think about what to say.  You can try out making a craft while talking with your peers.  The craft may be something you have not done in a while but are now getting back to as a way of relaxing, so it can be coloring, bead work, paint by number, whatever it may be.  The people around you can be discussing anything, and you can listen or speak up and add to the conversation.  One of the nice things is if you can find commonality with others.  There have been times when the others turned to one person and found she/he had an expertise in what they were talking about, so they learned more about the subject."
"occupational"|"Recommend and Activity"|"Suggest a weekend activity through CAN/SGA. Go to the next meeting of CAN or SGA and suggest your activity.  We are always looking for things to do on the weekend, so why not your thing?  On campus they have held mud volleyball matches and someone had to suggest it.  Think about the places you have been, and the activities held at those places.  If you think it would be a good fit with our campus, such as a karate tournament, suggest it.  We even tried to break a Guinness World Record on this campus – did not make the record but had an interesting time trying."
"occupational"|"Classes beyond the books"|"Take a photography/art class to see if you like it or just like learning about it.  Most students have given up art classes thinking they were “no good at it”, but you are a different person now.  Try a class again in one of the arts.  People have found they like it so much they get a side business going.  I encourage people to create what they like even if they do not think it is good, because then they can display it in their room or their apartment.  Sometimes we do not know how good we are at something.  I know someone who believes everyone can build a computer.  I bet there are a number of computer people who agree.  I do not have that talent, but he does.  Give art/photography/dance a chance to express yourself.  If you decide you do not like it, keep at least one memento to remind yourself of your courage to at least try."
"occupational"|"Review Writing"|"Spend time with friends writing reviews: sports, restaurants, movies, presentations.  This is a great way to spend your time and it really helps the people around you.  You and your friends can review local dinners and help students find the spot that is worth the money.  We have all had the experience of seeing a movie that we could have waited until HBO had the film, but we didn’t know.  With your review in hand the person could make a more informed and better choice.  Sports reviews are all over the YouTube market.  Get the practice in now and hone the skills that will get you 100,000 views. Write the reviews and share them with friends and family and get the feedback.  Help others to avoid wasting their time."
"occupational"|"Exploring likes and dislikes"|"Make a journal that includes your likes and dislikes.  Then when you go out shopping or out to eat, review the journal ahead of time. While out, choose differently.  Choose a different type of shirt/blouse or try a different type of food.  Too many of us get boxed in – going out to eat burgers, pizza, tacos or Chinese.  Mix it up a little or a lot and explore.  If you are not that adventurous, ask at your local place if there is something not on the menu that the establishment makes and try that.  Then write about it in your journal."
